results/hyperparameters_v4.1.json

{
    "n_estimators":600.0,
    "max_depth":5.0,
    "learning_rate":0.0810526073,
    "subsample":0.5848394118,
    "colsample_bytree":0.6241455026,
    "min_child_weight":33.0,
    "reg_alpha":0.4983704418,
    "reg_lambda":10.5454424495
}

DOCS.md

### Model 4.1

*Changes from v4: Deadzone = 0.002, tightened Optuna search space to reduce overfitting*\
**Features:** ["atr_14", "vol_ratio_lag3", "bb_width", "normalised_ema50", "hl_spread", "vol_ratio_lag4", "vol_ratio_lag1", "rsi_14", "macd_hist", "vol_ratio", "bb_position"]\
**Hyperparameters:** {\
"n_estimators": 600 *(100, 700)*,\
"max_depth": 5 *(3, 5)*,\
"learning_rate": 0.08105 *(0.005, 0.1)*,\
"subsample": 0.58484 *(0.4, 0.8)*,\
"colsample_bytree": 0.62415 *(0.4, 0.8)*,\
"min_child_weight": 33 *(1, 100)*,\
"reg_alpha": 0.49837 *(0.01, 5)*,\
"reg_lambda": 10.54544 *(5, 20)*\
}\
*(Search spaces in italicised brackets)*\
**Accuracy:** 44.581%\
**F1 score (macro-averaged):** 0.35252\
**F1 score (train set):** 0.60808\
**ROC-AUC score:** 0.56264\
**Confusion matrix:**
<br/>