results/hyperparameters_v4.2.json

{
    "n_estimators":440.0,
    "max_depth":4.0,
    "learning_rate":0.0712169867,
    "subsample":0.5454792009,
    "colsample_bytree":0.4645591451,
    "min_child_weight":56.0,
    "reg_alpha":5.4370866953,
    "reg_lambda":16.8263394434
}

DOCS.md

### Model 4.2

*Changes from v4.1: Deadzone = 0.0015, tightened Optuna search space further to reduce overfitting*\
**Features:** ["atr_14", "vol_ratio_lag3", "bb_width", "normalised_ema50", "hl_spread", "vol_ratio_lag4", "vol_ratio_lag1", "rsi_14", "macd_hist", "vol_ratio", "bb_position"]\
**Hyperparameters:** {\
"n_estimators": 440 *(100, 700)*,\
"max_depth": 4 *(3, 4)*,\
"learning_rate": 0.07122 *(0.005, 0.1)*,\
"subsample": 0.54548 *(0.4, 0.65)*,\
"colsample_bytree": 0.46456 *(0.4, 0.65)*,\
"min_child_weight": 56 *(1, 100)*,\
"reg_alpha": 5.43709 *(1, 10)*,\
"reg_lambda": 16.82634 *(10, 30)*\
}\
*(Search spaces in italicised brackets)*\
**Accuracy:** 39.871%\
**F1 score (macro-averaged):** 0.39014\
**F1 score (train set):** 0.51425\
**ROC-AUC score:** 0.56332\
**Confusion matrix:**
<br/>